"DESCRIPTION","DURATION IN MS","NAME","PARENT SUITE","START TIME","STATUS","STOP TIME","SUB SUITE","SUITE","TEST CLASS","TEST METHOD"
"","240","can delete all completed tasks","example to-do app","Tue Jun 03 15:47:07 GMT 2025","passed","Tue Jun 03 15:47:07 GMT 2025","","with a checked task","",""
"","330","displays two todo items by default","example to-do app","Tue Jun 03 15:47:06 GMT 2025","passed","Tue Jun 03 15:47:06 GMT 2025","","","",""
"","392","can add new todo items","example to-do app","Tue Jun 03 15:47:06 GMT 2025","passed","Tue Jun 03 15:47:06 GMT 2025","","","",""
"","249","can filter for completed tasks","example to-do app","Tue Jun 03 15:47:07 GMT 2025","passed","Tue Jun 03 15:47:07 GMT 2025","","with a checked task","",""
"","247","can filter for uncompleted tasks","example to-do app","Tue Jun 03 15:47:07 GMT 2025","passed","Tue Jun 03 15:47:07 GMT 2025","","with a checked task","",""
"","178","can check off an item as completed","example to-do app","Tue Jun 03 15:47:06 GMT 2025","passed","Tue Jun 03 15:47:07 GMT 2025","","","",""
