"DESCRIPTION","DURATION IN MS","NAME","PARENT SUITE","START TIME","STATUS","STOP TIME","SUB SUITE","SUITE","TEST CLASS","TEST METHOD"
"","177","can check off an item as completed","example to-do app","Tue Jun 03 16:42:58 GMT 2025","passed","Tue Jun 03 16:42:59 GMT 2025","","","",""
"","387","can add new todo items","example to-do app","Tue Jun 03 16:42:58 GMT 2025","passed","Tue Jun 03 16:42:58 GMT 2025","","","",""
"","245","can filter for completed tasks","example to-do app","Tue Jun 03 16:42:59 GMT 2025","passed","Tue Jun 03 16:42:59 GMT 2025","","with a checked task","",""
"","308","displays two todo items by default","example to-do app","Tue Jun 03 16:42:58 GMT 2025","passed","Tue Jun 03 16:42:58 GMT 2025","","","",""
"","253","can filter for uncompleted tasks","example to-do app","Tue Jun 03 16:42:59 GMT 2025","passed","Tue Jun 03 16:42:59 GMT 2025","","with a checked task","",""
"","243","can delete all completed tasks","example to-do app","Tue Jun 03 16:42:59 GMT 2025","passed","Tue Jun 03 16:42:59 GMT 2025","","with a checked task","",""
